{
  "$schema": "./registry.schema.json",
  "schemaVersion": 1,
  "registryRevision": 8,
  "generatedAt": "2026-10-08",
  "historyPath": "docs/claims/registry.history.json",
  "suppressionsPath": "docs/claims/suppressions.json",
  "externalApprovalEnabled": false,
  "claims": [
    {
      "id": "RW-CLAIM-0001",
      "statement": "In the reviewed EVM contract version, an ERC-3525 address-form value transfer decreases the source exactly once and creates an equal destination value; this technical result does not establish indexed or legal-register reconciliation.",
      "path": "docs/claims/README.md",
      "textSha256": "cdb9b11eee71b84e85766204363e55a731d5dbe8db1a1796950e80af6daec305",
      "recordSha256": "6d130ec43bb6a8af69247ea548fa8cdacd67beaf4834ecd5bd09295d3997e01e",
      "category": "SETTLEMENT",
      "status": "SELF_ASSESSED_UNREVIEWED",
      "scope": "Current Solidity implementation and regression test only.",
      "owner": "Protocol engineering",
      "reviewedBy": "UNREVIEWED — automated self-assessment, no human or panel review",
      "reviewedAt": "2026-10-07",
      "expiresAt": "2027-01-07",
      "evidence": [
        {
          "type": "REPOSITORY",
          "reference": "contracts/src/standards/erc3525/ERC3525.sol",
          "sha256": "c40e6b50c6941ff3c7be5f0d485a9c92e0cde2efa5d28e851b071e78c914017e"
        },
        {
          "type": "TEST",
          "reference": "contracts/test/EwpgERC3525Test.t.sol",
          "sha256": "c064777bf66770feaa7acfc4f38699b33761668adc26d2c78eedd99692b8862c",
          "ciCommandId": "contract-erc3525"
        }
      ],
      "limitations": [
        "Does not prove indexed state, finality, deployed bytecode identity, or legal-register reconciliation."
      ]
    },
    {
      "id": "RW-CLAIM-0002",
      "statement": "The regulatory-reporting module produces only opt-in, non-production DRAFT_UNVALIDATED prototype documents; a successful SFTP write is transport evidence, not authority filing or acceptance.",
      "path": "docs/claims/README.md",
      "textSha256": "0587035f080dfa5b3d79c3f57ebecac43cda757ae567ccc9ebf5c7d2913c0190",
      "recordSha256": "f44258d3323f183a50007ae1be63aea5517d3159fe282795d878f182adaf738c",
      "category": "OPERATIONS",
      "status": "SELF_ASSESSED_UNREVIEWED",
      "scope": "Repository defaults, readiness guard, draft payload marker, and transport-state model.",
      "owner": "Backend engineering",
      "reviewedBy": "UNREVIEWED — automated self-assessment, no human or panel review",
      "reviewedAt": "2026-10-07",
      "expiresAt": "2027-01-07",
      "evidence": [
        {
          "type": "REPOSITORY",
          "reference": "backend/src/main/resources/application.yml",
          "sha256": "1b273782ddfc98295fff055b6f3bdab0468664dae90a8837373556f2fa259de8"
        },
        {
          "type": "TEST",
          "reference": "backend/src/test/java/de/makibytes/registerwerk/regreporting/internal/MifirReportingServiceTest.java",
          "sha256": "32e0b1cebcb3da54440d2e91ec59bd3c7afbabb86aef10fc3c047a071272c2ff",
          "ciCommandId": "backend-regreporting"
        },
        {
          "type": "TEST",
          "reference": "backend/src/test/java/de/makibytes/registerwerk/regreporting/internal/Dac8ExportServiceTest.java",
          "sha256": "ca8667a5374e88ce6108cc395e070040a6c8b9c561f002b32e636050ce3adf7d",
          "ciCommandId": "backend-regreporting"
        },
        {
          "type": "TEST",
          "reference": "backend/src/test/java/de/makibytes/registerwerk/regreporting/internal/RegReportingProductionReadinessCheckTest.java",
          "sha256": "b09d234c4ffbbfb13a59a0fadeb03663b600c29fae4f5e9ce5dbf449db202d45",
          "ciCommandId": "backend-regreporting"
        },
        {
          "type": "TEST",
          "reference": "backend/src/test/java/de/makibytes/registerwerk/regreporting/internal/RegReportSubmissionsTest.java",
          "sha256": "424ee2f527fd920e2366da7898973fa17df2c7a5b96911098001c6ded5134f88",
          "ciCommandId": "backend-regreporting"
        }
      ],
      "limitations": [
        "No official schema, reportable population, reporting-entity decision, authority routing, authenticated receipt, corrections flow, or legal sign-off."
      ]
    },
    {
      "id": "RW-CLAIM-0003",
      "statement": "The EVM subgraph gate validates configured ABI handler signatures and compiles every mapping; it does not prove deployed bytecode identity, chain finality, replay correctness, or legal effect.",
      "path": "docs/claims/README.md",
      "textSha256": "11aa4589b9d1f86d75771c1c6a7efa5ec085f5d6aee9c18c2b6f3fd0530c5fd6",
      "recordSha256": "08a4a253f6b64c7b31e718271128986dab648b4c00d216f6b454823e314434d0",
      "category": "OPERATIONS",
      "status": "SELF_ASSESSED_UNREVIEWED",
      "scope": "Static EVM subgraph manifest, ABI, renderer, code generation, and mapping build gate.",
      "owner": "Indexer engineering",
      "reviewedBy": "UNREVIEWED — automated self-assessment, no human or panel review",
      "reviewedAt": "2026-10-07",
      "expiresAt": "2027-01-07",
      "evidence": [
        {
          "type": "TEST",
          "reference": "indexer/evm/subgraph/scripts/validate-abi-parity.mjs",
          "sha256": "07c9e61b3c7af4276d4880fb35bd11f87b5a979c583c3fa4c09bc74a0036772a",
          "ciCommandId": "indexer-subgraph"
        },
        {
          "type": "TEST",
          "reference": "indexer/evm/test-render-subgraph-manifest.sh",
          "sha256": "99a34902852f491540165d15c20005a4ceee5c5da68c02c995b941f4afeee19a",
          "ciCommandId": "indexer-subgraph"
        },
        {
          "type": "REPOSITORY",
          "reference": "indexer/evm/subgraph/package.json",
          "sha256": "a3db591a73adda4af35e7125e8d63ca9c707fc08bc586e263bc66c8e8a3391dc"
        }
      ],
      "limitations": [
        "No graph-node replay fixture, reorg test, RPC bytecode check, or approved deployment inventory."
      ]
    }
  ]
}
